[
  {
    "family": "Member Sign-In And Role Lens (Sprint A)",
    "id": "FR-AUTH-001",
    "kind": "FR",
    "mvp": false,
    "sourceCommit": "81ba62b8af0f684be3791a9105f2cf1d4d964726",
    "sourceLine": 488,
    "sourcePath": "docs/PRD.md",
    "title": "A tenant member shall be able to sign in and sign out of the Curavias app via Entra (the `ihzhhpf-app` registration); the signed-out state is the read-only Demo Guest."
  },
  {
    "family": "Member Sign-In And Role Lens (Sprint A)",
    "id": "FR-AUTH-002",
    "kind": "FR",
    "mvp": false,
    "sourceCommit": "81ba62b8af0f684be3791a9105f2cf1d4d964726",
    "sourceLine": 489,
    "sourcePath": "docs/PRD.md",
    "title": "The app shall derive the role lens (navigation, hospital scope, agent side-effect ceiling) from the ID-token `roles` claim; in SIT a holder of `HCC.PlatformAdmin` / `HCC.DemoOperator` may narrow to any role they actually hold (never elevate)."
  },
  {
    "family": "Member Sign-In And Role Lens (Sprint A)",
    "id": "FR-AUTH-003",
    "kind": "FR",
    "mvp": false,
    "sourceCommit": "81ba62b8af0f684be3791a9105f2cf1d4d964726",
    "sourceLine": 490,
    "sourcePath": "docs/PRD.md",
    "title": "A My Account view shall show the signed-in identity (display name, UPN, object id), the held `HCC.*` roles, and the active-role scope plus agent ceiling."
  },
  {
    "family": "Business Value Assessment Agent (Sprint 33)",
    "id": "FR-BVA-001",
    "kind": "FR",
    "mvp": false,
    "sourceCommit": "81ba62b8af0f684be3791a9105f2cf1d4d964726",
    "sourceLine": 435,
    "sourcePath": "docs/PRD.md",
    "title": "The platform shall produce grounded ROI/TCO answers computed over the `bva_*` gold measures, standardized in CHF."
  },
  {
    "family": "Business Value Assessment Agent (Sprint 33)",
    "id": "FR-BVA-002",
    "kind": "FR",
    "mvp": false,
    "sourceCommit": "81ba62b8af0f684be3791a9105f2cf1d4d964726",
    "sourceLine": 436,
    "sourcePath": "docs/PRD.md",
    "title": "The platform shall support interactive new-hospital what-if analysis via the deterministic `bva.simulate` tool, parametric and benchmarked from the three existing hospitals."
  },
  {
    "family": "Business Value Assessment Agent (Sprint 33)",
    "id": "FR-BVA-003",
    "kind": "FR",
    "mvp": false,
    "sourceCommit": "81ba62b8af0f684be3791a9105f2cf1d4d964726",
    "sourceLine": 437,
    "sourcePath": "docs/PRD.md",
    "title": "The platform shall compose a PO ↔ BVA fan-out into one cited answer: BVA numbers plus the Product Owner go/no-go verdict."
  },
  {
    "family": "Business Value Assessment Agent (Sprint 33)",
    "id": "FR-BVA-004",
    "kind": "FR",
    "mvp": false,
    "sourceCommit": "81ba62b8af0f684be3791a9105f2cf1d4d964726",
    "sourceLine": 438,
    "sourcePath": "docs/PRD.md",
    "title": "The platform shall capture an Opportunity in the Cosmos system-of-record, project it into a `bva_opportunity` gold table, and expose it in the Backstage pipeline view."
  },
  {
    "family": "Business Value Assessment Agent (Sprint 33)",
    "id": "FR-BVA-005",
    "kind": "FR",
    "mvp": false,
    "sourceCommit": "81ba62b8af0f684be3791a9105f2cf1d4d964726",
    "sourceLine": 439,
    "sourcePath": "docs/PRD.md",
    "title": "The platform shall surface BVA in the Curavias App Start (inline) and Backstage (pipeline) copilot rail."
  },
  {
    "family": "EPIC Closed-Loop Simulation Engine (Sprint 38)",
    "id": "FR-CLP-001",
    "kind": "FR",
    "mvp": false,
    "sourceCommit": "81ba62b8af0f684be3791a9105f2cf1d4d964726",
    "sourceLine": 458,
    "sourcePath": "docs/PRD.md",
    "title": "The platform shall provide a **deterministic, CI-runnable end-to-end patient-journey harness** that drives one synthetic patient through the capacity agents with a scripted HITL approval per step and asserts trajectory change."
  },
  {
    "family": "EPIC Closed-Loop Simulation Engine (Sprint 38)",
    "id": "FR-CLP-002",
    "kind": "FR",
    "mvp": false,
    "sourceCommit": "81ba62b8af0f684be3791a9105f2cf1d4d964726",
    "sourceLine": 459,
    "sourcePath": "docs/PRD.md",
    "title": "The harness shall cover the **happy path plus failure modes** (approval withheld, state drift/superseded, deliberate divergence), and shall share its journey definition with a **demo-able interactive run**."
  },
  {
    "family": "EPIC Closed-Loop Simulation Engine (Sprint 38)",
    "id": "FR-CLP-003",
    "kind": "FR",
    "mvp": false,
    "sourceCommit": "81ba62b8af0f684be3791a9105f2cf1d4d964726",
    "sourceLine": 460,
    "sourcePath": "docs/PRD.md",
    "title": "The platform shall feed `DC-SIM-OUTCOME-v1` **divergence** into the existing Sprint 30 evaluator library and advisory backlog as an agent-optimisation signal, and run a **calibration gate** asserting simulator internal consistency — all human-gated, advisory-only."
  },
  {
    "family": "Application Context Architecture (Sprint 29)",
    "id": "FR-CTX-001",
    "kind": "FR",
    "mvp": false,
    "sourceCommit": "81ba62b8af0f684be3791a9105f2cf1d4d964726",
    "sourceLine": 336,
    "sourcePath": "docs/PRD.md",
    "title": "The app shall derive a single `ContextEnvelope` from the signed-in user's claims and active role lens and attach it to every IQ read and agent turn."
  },
  {
    "family": "Application Context Architecture (Sprint 29)",
    "id": "FR-CTX-002",
    "kind": "FR",
    "mvp": false,
    "sourceCommit": "81ba62b8af0f684be3791a9105f2cf1d4d964726",
    "sourceLine": 337,
    "sourcePath": "docs/PRD.md",
    "title": "The app shall keep a separate conversation thread per `(userOid x agent)` so switching board-agents never leaks turns across agents, with a clean reset on sign-out."
  },
  {
    "family": "Application Context Architecture (Sprint 29)",
    "id": "FR-CTX-003",
    "kind": "FR",
    "mvp": false,
    "sourceCommit": "81ba62b8af0f684be3791a9105f2cf1d4d964726",
    "sourceLine": 338,
    "sourcePath": "docs/PRD.md",
    "title": "The app shall open the first patient-journey board the active role can see (role-first-eligible default) instead of a hard-coded default board."
  },
  {
    "family": "Application Context Architecture (Sprint 29)",
    "id": "FR-CTX-004",
    "kind": "FR",
    "mvp": false,
    "sourceCommit": "81ba62b8af0f684be3791a9105f2cf1d4d964726",
    "sourceLine": 339,
    "sourcePath": "docs/PRD.md",
    "title": "The app shall enforce per-user data scope (RLS by `hospitalScope`) and the OBO contract, simulated app-side this sprint and liftable to live Fabric RLS / OBO via configuration without code change."
  },
  {
    "family": "Bed Management Copilot And User Experience",
    "id": "FR-CX-001",
    "kind": "FR",
    "mvp": false,
    "sourceCommit": "81ba62b8af0f684be3791a9105f2cf1d4d964726",
    "sourceLine": 149,
    "sourcePath": "docs/PRD.md",
    "title": "The solution shall provide a copilot interface for operations teams to query bed and flow status."
  },
  {
    "family": "Bed Management Copilot And User Experience",
    "id": "FR-CX-002",
    "kind": "FR",
    "mvp": false,
    "sourceCommit": "81ba62b8af0f684be3791a9105f2cf1d4d964726",
    "sourceLine": 150,
    "sourcePath": "docs/PRD.md",
    "title": "The copilot shall provide grounded answers based on live operational data, forecast outputs, and discharge signals."
  },
  {
    "family": "Bed Management Copilot And User Experience",
    "id": "FR-CX-003",
    "kind": "FR",
    "mvp": false,
    "sourceCommit": "81ba62b8af0f684be3791a9105f2cf1d4d964726",
    "sourceLine": 151,
    "sourcePath": "docs/PRD.md",
    "title": "The copilot shall provide bottleneck explanations and recommended operational options."
  },
  {
    "family": "Bed Management Copilot And User Experience",
    "id": "FR-CX-004",
    "kind": "FR",
    "mvp": false,
    "sourceCommit": "81ba62b8af0f684be3791a9105f2cf1d4d964726",
    "sourceLine": 152,
    "sourcePath": "docs/PRD.md",
    "title": "The copilot shall present current bed state, predicted pressure windows, and likely same-day discharges."
  },
  {
    "family": "Bed Management Copilot And User Experience",
    "id": "FR-CX-005",
    "kind": "FR",
    "mvp": false,
    "sourceCommit": "81ba62b8af0f684be3791a9105f2cf1d4d964726",
    "sourceLine": 153,
    "sourcePath": "docs/PRD.md",
    "title": "Power BI-based operational visibility shall be available for non-conversational usage scenarios."
  },
  {
    "family": "Bed Management Copilot And User Experience",
    "id": "FR-CX-006",
    "kind": "FR",
    "mvp": false,
    "sourceCommit": "81ba62b8af0f684be3791a9105f2cf1d4d964726",
    "sourceLine": 154,
    "sourcePath": "docs/PRD.md",
    "title": "Copilot responses shall preserve references to source context and response timestamp metadata."
  },
  {
    "family": "Data And Interoperability",
    "id": "FR-DATA-001",
    "kind": "FR",
    "mvp": false,
    "sourceCommit": "81ba62b8af0f684be3791a9105f2cf1d4d964726",
    "sourceLine": 113,
    "sourcePath": "docs/PRD.md",
    "title": "The platform shall ingest provider-internal operational signals, including ED, ADT, bed-state, and discharge-related events."
  },
  {
    "family": "Data And Interoperability",
    "id": "FR-DATA-002",
    "kind": "FR",
    "mvp": false,
    "sourceCommit": "81ba62b8af0f684be3791a9105f2cf1d4d964726",
    "sourceLine": 114,
    "sourcePath": "docs/PRD.md",
    "title": "The platform shall support HL7 FHIR-oriented normalization where healthcare interoperability requires it."
  },
  {
    "family": "Data And Interoperability",
    "id": "FR-DATA-003",
    "kind": "FR",
    "mvp": false,
    "sourceCommit": "81ba62b8af0f684be3791a9105f2cf1d4d964726",
    "sourceLine": 115,
    "sourcePath": "docs/PRD.md",
    "title": "The platform shall maintain curated datasets that unify operational, planning, and model input data."
  },
  {
    "family": "Data And Interoperability",
    "id": "FR-DATA-004",
    "kind": "FR",
    "mvp": false,